{
  "listen": {
    "hostname": "0.0.0.0",
    "port": 8787
  },
  "maxRequestBytes": 1048576,
  "maxResponseBytes": 33554432,
  "requestTimeoutMs": 60000,
  "receiptCapacity": 10000,
  "receiptLogPath": "/var/lib/egrysa/receipts.jsonl",
  "receiptMaxLogBytes": 67108864,
  "receiptChainId": "egrysa-container-alpha",
  "providers": [
    {
      "id": "openai",
      "kind": "openai",
      "baseUrl": "https://api.openai.com",
      "apiKeyEnv": "OPENAI_API_KEY",
      "allowedModels": [
        "gpt-5.2",
        "gpt-5-mini"
      ],
      "dataPolicy": {
        "training": "disabled",
        "retention": "standard",
        "allowRaw": false
      }
    },
    {
      "id": "anthropic",
      "kind": "anthropic",
      "baseUrl": "https://api.anthropic.com",
      "apiKeyEnv": "ANTHROPIC_API_KEY",
      "allowedModels": [
        "claude-sonnet-4-20250514"
      ],
      "dataPolicy": {
        "training": "disabled",
        "retention": "standard",
        "allowRaw": false
      }
    },
    {
      "id": "local",
      "kind": "openai-compatible",
      "baseUrl": "http://localhost:11434/v1",
      "allowedModels": [
        "gpt-oss:20b"
      ],
      "local": true,
      "dataPolicy": {
        "training": "unknown",
        "retention": "none",
        "allowRaw": true
      }
    }
  ],
  "semanticDetector": {
    "enabled": false,
    "providerId": "local",
    "model": "gpt-oss:20b",
    "timeoutMs": 10000,
    "totalTimeoutMs": 30000,
    "maxInputBytes": 16384,
    "onDetectorFailure": "degrade",
    "kinds": [
      "person_name",
      "physical_address",
      "semantic_confidential"
    ]
  },
  "nerDetector": {
    "enabled": false,
    "baseUrl": "http://127.0.0.1:11436",
    "timeoutMs": 2000,
    "totalTimeoutMs": 6000,
    "maxInputBytes": 16384,
    "minConfidence": 0.5,
    "onDetectorFailure": "degrade",
    "kinds": [
      "person_name",
      "physical_address"
    ]
  },
  "policy": {
    "defaultProvider": "openai",
    "localProvider": "local",
    "sensitivity": "balanced",
    "blockKinds": [
      "credit_card",
      "private_key",
      "api_secret",
      "ssn",
      "aadhaar",
      "india_pan",
      "uk_nino",
      "nhs_number",
      "passport",
      "bank_account"
    ],
    "localOnlyKinds": [
      "confidential_term",
      "semantic_confidential"
    ],
    "transformKinds": [
      "email",
      "phone",
      "ipv4",
      "iban",
      "person_name",
      "physical_address",
      "ipv6",
      "mac_address",
      "date_of_birth",
      "crypto_wallet",
      "vin",
      "organization"
    ],
    "sensitiveTerms": [
      {
        "term": "Project Nightingale",
        "label": "initiative"
      },
      {
        "term": "Example Acquisition Target",
        "label": "organization"
      }
    ]
  }
}
