{
  "listen": {
    "hostname": "127.0.0.1",
    "port": 8787
  },
  "maxRequestBytes": 1048576,
  "maxResponseBytes": 33554432,
  "requestTimeoutMs": 60000,
  "receiptCapacity": 10000,
  "receiptLogPath": "data/receipts.stub.jsonl",
  "receiptMaxLogBytes": 67108864,
  "receiptChainId": "egrysa-local-alpha",
  "providers": [
    {
      "id": "local",
      "kind": "openai-compatible",
      "baseUrl": "http://127.0.0.1:11435/v1",
      "allowedModels": [
        "stub-echo"
      ],
      "local": true,
      "dataPolicy": {
        "training": "unknown",
        "retention": "none",
        "allowRaw": true
      }
    }
  ],
  "semanticDetector": {
    "enabled": false,
    "providerId": "local",
    "model": "stub-echo",
    "timeoutMs": 10000,
    "totalTimeoutMs": 30000,
    "maxInputBytes": 16384,
    "onDetectorFailure": "degrade",
    "kinds": [
      "person_name",
      "physical_address",
      "semantic_confidential"
    ]
  },
  "policy": {
    "defaultProvider": "local",
    "localProvider": "local",
    "sensitivity": "balanced",
    "blockKinds": [
      "credit_card",
      "private_key",
      "api_secret",
      "ssn",
      "aadhaar",
      "india_pan",
      "uk_nino",
      "nhs_number",
      "passport",
      "bank_account",
      "prompt_injection"
    ],
    "localOnlyKinds": [
      "confidential_term",
      "semantic_confidential"
    ],
    "transformKinds": [
      "email",
      "phone",
      "ipv4",
      "iban",
      "person_name",
      "physical_address",
      "ipv6",
      "mac_address",
      "date_of_birth",
      "crypto_wallet",
      "vin",
      "organization"
    ],
    "sensitiveTerms": [
      {
        "term": "Project Nightingale",
        "label": "initiative"
      },
      {
        "term": "Example Acquisition Target",
        "label": "organization"
      }
    ]
  }
}
